<?xml version="1.0" encoding="utf-8"?>
<xs:schema xmlns:xs="http://www.w3.org/2001/XMLSchema">
  <xs:element name="annuaire">
    <xs:complexType>
      <xs:sequence>
        <xs:element name="contact" type="contactType" maxOccurs="unbounded"></xs:element>
      </xs:sequence>
    </xs:complexType>
  </xs:element>
  
  <xs:complexType name="contactType">
    <xs:sequence>
      <xs:element name="nom" type="xs:string"></xs:element>
      <xs:element name="prenom" type="xs:string"></xs:element>
      <xs:element name="telephone" type="numerosType" minOccurs="0"></xs:element>
      <xs:element name="email" type="xs:string" maxOccurs="unbounded"></xs:element>
    </xs:sequence>
    <xs:attribute name="titre" type="xs:string" use="required"></xs:attribute>
    <xs:attribute name="techno" type="xs:string" use="optional"></xs:attribute>
  </xs:complexType>
  
  <xs:complexType name="numerosType">
    <xs:sequence>
      <xs:element name="indicatif" type="xs:positiveInteger"></xs:element>
      <xs:element name="numero" type="xs:positiveInteger"></xs:element>
    </xs:sequence>
  </xs:complexType>
</xs:schema>